{
  "name": "林茜_妻心如刀_v1.3.32",
  "description": "",
  "personality": "",
  "scenario": "",
  "exampleDialogue": "",
  "systemPrompt": "",
  "tags": [],
  "creator": "flyhorse",
  "characterVersion": "1.3.32",
  "creatorNotes": "角色卡作者: flyhorse\n联系方式: 3691970+fzfz@users.noreply.github.com\n来源: Discord 类脑社区\n作者: [本人]\n商业用途: [绝对不可以]\n二改: [可以]\n二改后不标注出处发布: [不可以]\n",
  "worldbooks": [
    {
      "id": "linxi",
      "file": "worldbooks/linxi/book.json",
      "enabled": true
    }
  ],
  "stateUpdate": "agents/state-update/profile.json",
  "promptController": "backend/controllers/config.json"
}
